{
  "interfaces": {
    "units": {
      "source": [
        "MW",
        "rad"
      ],
      "relation": "units and bases are unchanged",
      "target": [
        "MW",
        "rad"
      ]
    },
    "decisions": {
      "source": [
        "served power"
      ],
      "relation": "the same served-power decision is optimized in all formulations",
      "target": [
        "served power"
      ]
    },
    "constraints": {
      "source": [
        "member flow limits"
      ],
      "relation": "the naive target drops member limits; the exact lift retains them",
      "target": [
        "summed aggregate flow limit"
      ]
    },
    "boundary_quantities": {
      "source": [
        "delta_ij",
        "sum of member terminal flows"
      ],
      "relation": "the unconstrained terminal power-angle relation is equal",
      "target": [
        "delta_ij",
        "aggregate terminal flow"
      ]
    },
    "objectives": {
      "source": [
        "maximize served power"
      ],
      "relation": "objective expression is identical but feasible sets differ",
      "target": [
        "maximize served power"
      ]
    },
    "state_variables": {
      "source": [
        "delta_ij",
        "f_l1ij",
        "f_l2ij"
      ],
      "relation": "aggregate flow is the sum of member flows; member flows recover from delta_ij",
      "target": [
        "delta_ij",
        "f_eqij"
      ]
    }
  },
  "preconditions": [
    "parallel members have common endpoint voltage coordinates",
    "member flows are linear in the common angle difference",
    "member susceptances are positive"
  ],
  "rule_id": "parallel_admittance_with_summed_rating",
  "provenance": {
    "solver": "Ipopt through JuMP",
    "implementation": "experiments/transformations/ParallelDecisionComparison.jl"
  },
  "classification": "outer_relaxation",
  "target": {
    "object_ids": [
      "naive_parallel_aggregate_l"
    ],
    "detail": {
      "flow_limit_MW": 200,
      "susceptance_MW_per_rad": 1100
    },
    "model_category": "two_bus_naive_aggregate_decision_model"
  },
  "certificate_id": "TR-PAR-003",
  "preserves": [
    "unconstrained_terminal_power_angle_relation"
  ],
  "constraint_map": {
    "naive_aggregate": "sum_l f_lij <= sum_l f_max_l",
    "exact_lifted": "retain f_lij = b_l * delta_ij and f_lij <= f_max_l for every l"
  },
  "source": {
    "object_ids": [
      "parallel_member_l1",
      "parallel_member_l2"
    ],
    "detail": {
      "flow_limit_MW": [
        100,
        100
      ],
      "susceptance_MW_per_rad": [
        1000,
        100
      ]
    },
    "model_category": "two_bus_parallel_member_decision_model"
  },
  "forgets": [
    "member_flow_limits",
    "member_identity",
    "independent_member_flow_state"
  ],
  "recovery_map": {
    "member_flows": "f_lij = b_l * delta_ij"
  },
  "typed_interfaces": {
    "target_unit_families": [
      "power"
    ],
    "unresolved_unit_labels": [
      "rad"
    ],
    "target_boundary_labels": [
      "delta_ij",
      "aggregate terminal flow"
    ],
    "source_unit_families": [
      "power"
    ],
    "state_space_ref": "experiments/generated/state-space-unit-witness.json",
    "state_domain_ids": [
    ],
    "attachment_rule": "certificate-local interface labels are crosswalked to the checked typed state-space/unit vocabulary; unresolved labels remain explicit rather than being guessed",
    "unit_family_map": {
      "MW": [
        "power"
      ],
      "rad": [
      ]
    },
    "source_boundary_labels": [
      "delta_ij",
      "sum of member terminal flows"
    ],
    "source_variable_labels": [
      "delta_ij",
      "f_l1ij",
      "f_l2ij"
    ],
    "target_variable_labels": [
      "delta_ij",
      "f_eqij"
    ]
  },
  "evidence": {
    "naive_objective_gap_MW": 90.00000090000007,
    "source_solution": {
      "objective_MW": 110.00000109749398,
      "member_flows_MW": [
        100.0000009977218,
        10.00000009977218
      ],
      "termination_status": "LOCALLY_SOLVED",
      "served_power_MW": 110.00000109749398,
      "angle_difference_rad": 0.1000000009977218
    },
    "exact_lifted_solution": {
      "objective_MW": 110.00000109749398,
      "member_flows_MW": [
        100.0000009977218,
        10.00000009977218
      ],
      "termination_status": "LOCALLY_SOLVED",
      "served_power_MW": 110.00000109749398,
      "angle_difference_rad": 0.1000000009977218
    },
    "exact_lifted_objective_gap_MW": 0,
    "naive_aggregate_solution": {
      "objective_MW": 200.00000199749405,
      "member_flows_MW": null,
      "termination_status": "LOCALLY_SOLVED",
      "served_power_MW": 200.00000199749405,
      "angle_difference_rad": 0.1818181836340855
    }
  },
  "schema_version": "1.1.0"
}
