{
  "interfaces": {
    "units": {
      "source": [
        "V",
        "A"
      ],
      "relation": "terminal permutation leaves voltage and current units unchanged",
      "target": [
        "V",
        "A"
      ]
    },
    "decisions": {
      "source": [],
      "relation": "no tap, switching, or investment decision is changed",
      "target": []
    },
    "constraints": {
      "source": [
        "coil current limits"
      ],
      "relation": "coil-indexed constraints are unchanged",
      "target": [
        "coil current limits"
      ]
    },
    "boundary_quantities": {
      "source": [
        "winding terminal voltages",
        "coil voltages"
      ],
      "relation": "A_target * U_target = A_source * U_source",
      "target": [
        "winding terminal voltages",
        "coil voltages"
      ]
    },
    "objectives": {
      "source": [],
      "relation": "no winding-local objective term is declared",
      "target": []
    },
    "state_variables": {
      "source": [
        "source-order winding terminal voltages",
        "stable coil voltages"
      ],
      "relation": "terminal voltages map by P while coil coordinates remain fixed",
      "target": [
        "target-order winding terminal voltages",
        "stable coil voltages"
      ]
    }
  },
  "preconditions": [
    "source and target terminal labels are unique",
    "source and target terminal sets are equal",
    "the complete terminal-to-coil relation is transformed",
    "coil coordinates and coil limits retain their identities"
  ],
  "rule_id": "transformer_winding_terminal_normalization",
  "preserves": [
    "all_declared_source_semantics",
    "winding_terminal_to_coil_voltage_relation",
    "winding_connection_semantics",
    "coil_current_limits",
    "transformer_and_winding_identity"
  ],
  "constraint_map": {
    "target_connection": "A_target = A_source * P'",
    "target_terminal_voltage": "u_target = P * u_source",
    "coil_limits": "coil coordinates are unchanged, so their limits are unchanged"
  },
  "provenance": {
    "generated_object": "normalized__x1_winding_3__c_a_b",
    "source_transformer": "x1",
    "source_winding": 3
  },
  "classification": "exact_normalization",
  "source": {
    "object_ids": [
      "x1/winding/3"
    ],
    "detail": {
      "coil_labels": [
        "a",
        "b",
        "c"
      ],
      "winding_position": 3,
      "transformer_id": "x1",
      "connection": "DELTA"
    },
    "model_category": "typed_multiwinding_transformer_winding_factor"
  },
  "forgets": [],
  "recovery_map": {
    "source_connection": "A_source = A_target * P",
    "source_terminal_voltage": "u_source = P' * u_target"
  },
  "target": {
    "object_ids": [
      "normalized__x1_winding_3__c_a_b"
    ],
    "detail": {
      "coil_current_limit_A": [
        280,
        280,
        280
      ],
      "terminal_order": [
        "c",
        "a",
        "b"
      ],
      "coil_labels": [
        "a",
        "b",
        "c"
      ],
      "terminal_to_coil_incidence": [
        [
          -1,
          1,
          0
        ],
        [
          0,
          -1,
          1
        ],
        [
          1,
          0,
          -1
        ]
      ]
    },
    "model_category": "typed_multiwinding_transformer_winding_factor"
  },
  "evidence": {
    "permutation_matrix": [
      [
        0,
        0,
        1
      ],
      [
        1,
        0,
        0
      ],
      [
        0,
        1,
        0
      ]
    ],
    "source_terminal_order": [
      "a",
      "b",
      "c"
    ],
    "source_terminal_to_coil_incidence": [
      [
        1,
        0,
        -1
      ],
      [
        -1,
        1,
        0
      ],
      [
        0,
        -1,
        1
      ]
    ],
    "target_terminal_to_coil_incidence": [
      [
        -1,
        1,
        0
      ],
      [
        0,
        -1,
        1
      ],
      [
        1,
        0,
        -1
      ]
    ],
    "target_terminal_order": [
      "c",
      "a",
      "b"
    ]
  },
  "schema_version": "1.1.0",
  "certificate_id": "TR-XFMR-001",
  "typed_interfaces": {
    "state_space_ref": "experiments/generated/state-space-unit-witness.json",
    "source_variable_labels": [
      "source-order winding terminal voltages",
      "stable coil voltages"
    ],
    "target_variable_labels": [
      "target-order winding terminal voltages",
      "stable coil voltages"
    ],
    "source_unit_families": [
      "current",
      "voltage"
    ],
    "target_unit_families": [
      "current",
      "voltage"
    ],
    "source_boundary_labels": [
      "winding terminal voltages",
      "coil voltages"
    ],
    "target_boundary_labels": [
      "winding terminal voltages",
      "coil voltages"
    ],
    "state_domain_ids": [],
    "unit_family_map": {
      "A": [
        "current"
      ],
      "V": [
        "voltage"
      ]
    },
    "unresolved_unit_labels": [],
    "attachment_rule": "certificate-local interface labels are crosswalked to the checked typed state-space/unit vocabulary; unresolved labels remain explicit rather than being guessed"
  }
}
