{
  "interfaces": {
    "units": {
      "source": [
        "V",
        "A",
        "ohm"
      ],
      "relation": "units are unchanged",
      "target": [
        "V",
        "A",
        "ohm"
      ]
    },
    "decisions": {
      "source": [
      ],
      "relation": "the scalar witness declares no optimization decision",
      "target": [
      ]
    },
    "constraints": {
      "source": [
        "member current limits"
      ],
      "relation": "the summed limit is an outer relaxation of the member limits",
      "target": [
        "summed aggregate current limit"
      ]
    },
    "boundary_quantities": {
      "source": [
        "delta_u_ij",
        "sum of member currents"
      ],
      "relation": "unconstrained terminal current-voltage relation is equal",
      "target": [
        "delta_u_ij",
        "aggregate current"
      ]
    },
    "objectives": {
      "source": [
      ],
      "relation": "the scalar witness declares no objective",
      "target": [
      ]
    },
    "state_variables": {
      "source": [
        "delta_u_ij",
        "i_l1ij",
        "i_l2ij"
      ],
      "relation": "aggregate current is the sum and member currents recover from delta_u_ij",
      "target": [
        "delta_u_ij",
        "i_eqij"
      ]
    }
  },
  "preconditions": [
    "parallel members have common endpoint voltage coordinates",
    "member currents are linear in the common voltage drop",
    "member admittances are retained for recovery"
  ],
  "rule_id": "parallel_admittance_with_summed_current_rating",
  "preserves": [
    "unconstrained_terminal_current_voltage_relation"
  ],
  "constraint_map": {
    "naive_aggregate": "magnitude(sum_l i_lij) <= sum_l i_max_l",
    "exact_lifted": "retain i_lij = y_l * delta_u_ij and magnitude(i_lij) <= i_max_l for every l"
  },
  "provenance": {
    "fixture_members": [
      "l1",
      "l2"
    ],
    "implementation": "experiments/run_vertical_slice.jl"
  },
  "classification": "outer_relaxation",
  "source": {
    "object_ids": [
      "parallel_member_l1",
      "parallel_member_l2"
    ],
    "detail": {
      "maximum_admissible_voltage_drop_V": 10,
      "i_max_A": [
        100,
        100
      ],
      "z_ohm": [
        0.1,
        1.0
      ]
    },
    "model_category": "scalar_parallel_member_model"
  },
  "forgets": [
    "member_current_limits",
    "member_identity",
    "independent_member_state"
  ],
  "recovery_map": {
    "member_currents": "i_lij = y_l * delta_u_ij"
  },
  "target": {
    "object_ids": [
      "naive_parallel_aggregate_l"
    ],
    "detail": {
      "z_equivalent_ohm": 0.09090909090909091,
      "maximum_admissible_voltage_drop_V": 18.181818181818183,
      "i_max_A": 200
    },
    "model_category": "scalar_naive_parallel_aggregate_model"
  },
  "evidence": {
    "classification_reason": "the target admits a voltage drop that violates one source member limit",
    "witness": {
      "source_feasible": false,
      "aggregate_current_A": 165,
      "target_feasible": true,
      "member_currents_A": [
        150,
        15
      ],
      "voltage_drop_V": 15
    }
  },
  "schema_version": "1.1.0",
  "certificate_id": "TR-PAR-001"
}
