{
  "interfaces": {
    "units": {
      "source": [
        "V",
        "A",
        "ohm"
      ],
      "relation": "physical units are unchanged",
      "target": [
        "V",
        "A",
        "ohm"
      ]
    },
    "decisions": {
      "source": [
      ],
      "relation": "no decision variables are introduced or removed by this fixed-state rule",
      "target": [
      ]
    },
    "constraints": {
      "source": [
        "member current-feasible sets",
        "zero-injection junction equations"
      ],
      "relation": "member constraints map by intersection after conductor alignment",
      "target": [
        "coordinate-aligned intersection current-feasible set"
      ]
    },
    "boundary_quantities": {
      "source": [
        "U_i",
        "U_j",
        "terminal currents"
      ],
      "relation": "external terminal voltage-current behaviour is equal",
      "target": [
        "U_i",
        "U_j",
        "equivalent terminal current"
      ]
    },
    "objectives": {
      "source": [
      ],
      "relation": "no objective term is declared by the local element rule",
      "target": [
      ]
    },
    "state_variables": {
      "source": [
        "U_i",
        "U_b",
        "U_j",
        "I_l1ib",
        "I_l2bj"
      ],
      "relation": "source currents and the eliminated junction voltage recover from the equivalent current",
      "target": [
        "U_i",
        "U_j",
        "I_leqij"
      ]
    }
  },
  "preconditions": [
    "the first element ends at the eliminated junction",
    "the second element starts at the eliminated junction",
    "junction conductor sets agree up to permutation",
    "the junction has no injection, shunt, grounding, measurement, control, or protection boundary",
    "neither source element has an external mutual coupling"
  ],
  "rule_id": "degree_two_series_elimination",
  "preserves": [
    "external_terminal_voltage_current_relation",
    "ordered_conductor_identity",
    "source_current_limits_via_intersection",
    "source_to_target_provenance"
  ],
  "constraint_map": {
    "componentwise_current_limit": "i_max_equivalent = min(i_max_l5, P' * i_max_l6)",
    "current_feasible_set": "C_equivalent = C_l5 intersect P' * C_l6"
  },
  "provenance": {
    "generated_object": "generated_series__l5__l6",
    "eliminated_junction": "ib",
    "source_elements": [
      "l5",
      "l6"
    ]
  },
  "classification": "exact_behavioral_reduction",
  "source": {
    "object_ids": [
      "l5",
      "l6",
      "ib"
    ],
    "model_category": "ordered_multiconductor_series_chain"
  },
  "forgets": [
    "independent_visibility_of_the_internal_junction"
  ],
  "recovery_map": {
    "source_current_l6": "i_l6 = P * i_equivalent",
    "source_current_l5": "i_l5 = i_equivalent",
    "junction_voltage": "u_ib = u_i7 - Z_l5 * i_equivalent"
  },
  "target": {
    "object_ids": [
      "generated_series__l5__l6"
    ],
    "detail": {
      "bus_from": "i7",
      "bus_to": "i8",
      "terminal_map_from": [
        "a",
        "n"
      ],
      "terminal_map_to": [
        "a",
        "n"
      ],
      "impedance_ohm": [
        [
          {
            "re": 0.30000000000000004,
            "im": 0.5
          },
          {
            "re": 0.05,
            "im": 0.09
          }
        ],
        [
          {
            "re": 0.05,
            "im": 0.09
          },
          {
            "re": 0.7,
            "im": 0.4
          }
        ]
      ],
      "current_limit_A": [
        110,
        80
      ],
      "physical_classification": "exact_behavioral_composite_not_a_homogeneous_physical_line"
    },
    "model_category": "ordered_multiconductor_series_element"
  },
  "evidence": {
    "impedance_derivation": "Z_equivalent = Z_first + P' * Z_second * P",
    "physical_classification": "exact_behavioral_composite_not_a_homogeneous_physical_line",
    "conductor_permutation": [
      [
        0,
        1
      ],
      [
        1,
        0
      ]
    ]
  },
  "schema_version": "1.1.0",
  "certificate_id": "TR-SER-001"
}
